{
  "generatedAt": "2026-08-09T20:00:00Z",
  "items": [
    {
      "author": "ScriptWidget Community",
      "featured": true,
      "files": [
        {
          "bytes": 605,
          "path": "main.jsx",
          "sha256": "70eeb6c0447c3dbce7544e2f2f2e4e62a0153100c857790d633628f1d97bbc6a",
          "url": "https://raw.githubusercontent.com/everettjf/scriptwidget/main/Gallery/widgets/hello-card/main.jsx"
        },
        {
          "bytes": 899,
          "path": "widget.json",
          "sha256": "666f3d668670f53774f46d3f760f650a86b612a13677a5f17947c44fd5386dba",
          "url": "https://raw.githubusercontent.com/everettjf/scriptwidget/main/Gallery/widgets/hello-card/widget.json"
        }
      ],
      "id": "app.scriptwidget.gallery.hello-card",
      "kind": "widget",
      "license": "MIT",
      "minimumRuntimeVersion": "1.0",
      "name": "Gallery Hello Card",
      "sourceURL": "https://github.com/everettjf/scriptwidget/tree/main/Gallery/widgets/hello-card",
      "summary": "A polished offline starter that demonstrates a responsive Gallery install.",
      "symbol": "sparkles.rectangle.stack",
      "tags": [
        "starter",
        "offline"
      ],
      "version": "1.0.0"
    },
    {
      "author": "ScriptWidget Community",
      "featured": true,
      "files": [
        {
          "bytes": 380,
          "path": "skill.json",
          "sha256": "a39e6222e3dd99fca17437f8df176e4ac2dce24124f182ae6369d6a0acbfbee8",
          "url": "https://raw.githubusercontent.com/everettjf/scriptwidget/main/Gallery/skills/privacy-review/skill.json"
        },
        {
          "bytes": 477,
          "path": "SKILL.md",
          "sha256": "94fdf8df56b4343b0915441d652abb58e852d58cea83c86aae262114e63281b5",
          "url": "https://raw.githubusercontent.com/everettjf/scriptwidget/main/Gallery/skills/privacy-review/SKILL.md"
        }
      ],
      "id": "app.scriptwidget.gallery.privacy-review",
      "kind": "skill",
      "license": "MIT",
      "minimumRuntimeVersion": "1.0",
      "name": "Privacy Review",
      "sourceURL": "https://github.com/everettjf/scriptwidget/tree/main/Gallery/skills/privacy-review",
      "summary": "Review a widget for minimal data access and clear fallbacks.",
      "symbol": "hand.raised.fill",
      "tags": [
        "privacy",
        "review"
      ],
      "version": "1.0.0"
    }
  ],
  "repository": "https://github.com/everettjf/scriptwidget",
  "schemaVersion": 1
}
